{"format":"ledger-tsa-qualifiziert/1","quelle":"Testkorpus, aus keiner Vertrauensliste abgeleitet","stand":"2026-01-01T00:00:00Z","wurzeln":[{"qualifiziert_ab":"2026-01-04T00:00:00Z","zertifikat":"MIIBfjCCATCgAwIBAgIBATAFBgMrZXAwVjETMBEGA1UECgwKVGVzdGtvcnB1czE/MD0GA1UEAww2VGVzdGtvcnB1cyBaZWl0c3RlbXBlbHd1cnplbCBFMSAoU2NobHVlc3NlbCB2ZXJ3b3JmZW4pMB4XDTI1MDEwMTAwMDAwMFoXDTM2MDEwMTAwMDAwMFowVjETMBEGA1UECgwKVGVzdGtvcnB1czE/MD0GA1UEAww2VGVzdGtvcnB1cyBaZWl0c3RlbXBlbHd1cnplbCBFMSAoU2NobHVlc3NlbCB2ZXJ3b3JmZW4pMCowBQYDK2VwAyEAPE5v1nfRH2vrWv60kHZquZN/+uPlGVblr/zXNuqK996jIzAhMA8GA1UdEwEB/wQFMAMBAf8wDgYDVR0PAQH/BAQDAgEGMAUGAytlcANBAJJjkUpiSs6Rf20+pYMfghLTz4mgwaOzjBQwQ0KJpUIRI8Y9BlzV9cA/bUYvsL0kAJUcmpE62VRmhwkT2PEgSww="}]}
